X,y
"Hi,  I've noticed that if you only save a model (with all your mapping planes positioned carefully) to a .3DS file that when you reload it after restarting 3DS, they are given a default position and orientation.  But if you save to a .PRJ file their positions/orientation are preserved.  Does anyone know why this information is not stored in the .3DS file?  Nothing is explicitly said in the manual about saving texture rules in the .PRJ file.  I'd like to be able to read the texture rule information, does anyone have  the format for the .PRJ file?  Is the .CEL file format available from somewhere?  Rych",1
"Seems to be, barring evidence to the contrary, that Koresh was simply another deranged fanatic who thought it neccessary to take a whole bunch of folks with him, children and all, to satisfy his delusional mania. Jim Jones, circa 1993.   Nope - fruitcakes like Koresh have been demonstrating such evil corruption for centuries.",3
">In article <1993Apr19.020359.26996@sq.sq.com>, msb@sq.sq.com (Mark Brader)   MB>                                                             So the MB> 1970 figure seems unlikely to actually be anything but a perijove.  JG>Sorry, _perijoves_...I'm not used to talking this language.  Couldn't we just say periapsis or apoapsis?",2
"I have a request for those who would like to see Charley Wingate respond to the ""Charley Challenges"" (and judging from my e-mail, there appear to be quite a few of you.)    It is clear that Mr. Wingate intends to continue to post tangential or unrelated articles while ingoring the Challenges themselves.  Between the last two re-postings of the Challenges, I noted perhaps a dozen or more posts by Mr. Wingate, none of which answered a single Challenge.    It seems unmistakable to me that Mr. Wingate hopes that the questions will just go away, and he is doing his level best to change the subject.  Given that this seems a rather common net.theist tactic, I would like to suggest that we impress upon him our desire for answers, in the following manner:  1. Ignore any future articles by Mr. Wingate that do not address the Challenges, until he answers them or explictly announces that he refuses to do so.  --or--  2. If you must respond to one of his articles, include within it something similar to the following:      ""Please answer the questions posed to you in the Charley Challenges.""  Really, I'm not looking to humiliate anyone here, I just want some honest answers.  You wouldn't think that honesty would be too much to ask from a devout Christian, would you?    Nevermind, that was a rhetorical question.",0
"AW&ST  had a brief blurb on a Manned Lunar Exploration confernce May 7th  at Crystal City Virginia, under the auspices of AIAA.  Does anyone know more about this?  How much, to attend????  Anyone want to go?",2
"There are definitely quite a few horrible deaths as the result of both atheists AND theists.  I'm sure Bobby can list quite a few for the atheist side but fails to recognize that the theists are equally proficient at genocide.  Perhaps, since I'm a bit weak on history, somone here would like to give a list of wars caused/led by theists?  I can think of a few (Hitler claimed to be a Christian for example) but a more complete list would probably be more effective in showing Bobby just how absurd his statement is.   On a side note, I notice you always sign your posts ""Peace"".  Perhaps you should take your own advice and leave the atheists in peace with their beliefs?   Nanci",0
"Mark Prado       Old pioneer song from the 1850's or so goes as follows:      ""In a cavern, in a canyon,    Excavating for a mine,    Dwelt a miner, forty-niner,    And his daughter, CLEMENTINE""    Chorus:   ""Oh my darling, Oh my darling,    Oh my darling Clementine.    You are lost and gone forever,    Oh my darling Clementine.""     I've also had it explained (but not confirmed from a reliable data source) that CLEMENTINE is an acronym.  Something like Combined Lunar Elemental Mapper Experiment on Extended Non Terrestrial Intercept Near Earth.  Personally, I think that acronym was made up to fit the name (if it really is an acronym).  ------------------------------------------------------------------  Wales Larrison                           Space Technology Investor",2
"Acorn Replay running on a 25MHz ARM 3 processor (the ARM 3 is about 20% slower than the ARM 6) does this in software (off a standard CD-ROM). 16 bit colour at about the same resolution (so what if the computer only has 8 bit colour support, real-time dithering too...). The 3D0/O is supposed to have a couple of DSPs - the ARM being used for housekeeping.   A 25MHz ARM 6xx should clock around 20 ARM MIPS, say 18 flat out. Depends really on the surrounding system and whether you are talking ARM6x or ARM6xx (the latter has a cache, and so is essential to run at this kind of speed with slower memory).  I'll stop saying things there 'cos I'll hopefully be working for ARM after graduation...  Mike  PS Don't pay heed to what reps from Philips say; if the 3D0/O doesn't beat the    pants off 3DI then I'll eat this postscript.",1
"Their Hiten engineering-test mission spent a while in a highly eccentric Earth orbit doing lunar flybys, and then was inserted into lunar orbit using some very tricky gravity-assist-like maneuvering.  This meant that it would crash on the Moon eventually, since there is no such thing as a stable lunar orbit (as far as anyone knows), and I believe I recall hearing recently that it was about to happen.",2
"I'm interested in find out what is involved in processing pairs of  stereo photographs.  I have black-and-white photos and would like  to obtain surface contours.  I'd prefer to do the processing on an SGI, but would be interested in hearing what software/hardware is used for this type of image processing.  Please email and/or post to comp.sys.sgi.graphics your responses.  Thanks,",1
"a  What about positional uncertainties in S-L 1993e?   I assume we know where and what Galileo is doing within a few meters.   But without the HGA,  don't we have to have some pretty good ideas, of where to look before imaging?  If the HGA was working,  they could slew around in near real time (Less speed of light delay).  But when they were imaging toutatis????  didn't someone have to get lucky on a guess to find the first images?     Also, I imagine S-L 1993e will be mostly a visual image.  so how will that affect the other imaging missions.  with the LGA,  there is a real tight allocation of bandwidth.   It may be premature to hope for answers, but I thought i'd throw it on the floor.",2
I would like to program Tseng ET4000 to nonstandard 1024x768 mode by switching to standard 1024x768 mode using BIOS and than changing some timing details (0x3D4 registers 0x00-0x1F) but I don't know how to select 36 MHz pixel clock I need. The BIOS function selects 40 MHz.  Is there anybody who knows where to obtain technical info about this. I am also interested in any other technical information about Tseng ET4000 and Trident 8900 and 9000 chipsets.  			thanks very much,1
"In-Reply-To: <20APR199312262902@rigel.tamu.edu> lmp8913@rigel.tamu.edu (PRESTON, LISA M)",1
"I'm not sure, but it almost sounds like they can't figure out where the  _nucleus_ is within the coma. If they're off by a couple hundred miles, well, you can imagine the rest...",2
"Hello,      I am looking to add voice input capability to a user interface I am developing on an HP730 (UNIX) workstation.  I would greatly appreciate  information anyone would care to offer about voice input systems that are  easily accessible from the UNIX environment.        The names or adresses of applicable vendors, as well as any  experiences you have had with specific systems, would be very helpful.       Please respond via email; I will post a summary if there is  sufficient interest.   Thanks, Ken   P.S.  I have found several impressive systems for IBM PC's, but I would  like to avoid the hassle of purchasing and maintaining a separate PC if  at all possible.  ------------------------------------------------------------------------------- Ken Hinckley (kph2q@virginia.edu) University of Virginia  Neurosurgical Visualization Laboratory",1
"It was a test of the first reusable tool.   Pointy so they can find them or so they will stick into their pants better, and be closer to their brains?",2
"Size of armies, duration, numbers of casualties both absolute and as a percentage of those involved, geographical area and numbers of countries too, are all measures of size.  In this case I'd say the relevant statistic would be the number of combatants (total troops) compared to total casualties from among the total civilian population in the affected geographical area.   Vietnam and Korea might make good comparisons.   Western news in general, but in particular the American ""mass media"": CBS, NBC, ABC, etc.  The general tone of the news during the whole war was one of ""those poor, poor Iraqis"" along with ""look how precisely this cruise missile blew this building to bits"".   I agree.   Perhaps so.  And maybe the atomic bomb was a mistake too.  But that's easy to say from our ""enlightened"" viewpoint here in the 90's, right?  Back then, it was *all-out* war, and Germany and Japan had to be squashed. After all, a million or more British had already died, hundreds of  thousands of French, a couple hundread thousand or so Americans, and  millions of Russians, not to mention a few million Jews, Poles, and  other people of slavic descent in German concentration camps.  All  things considered, the fire-bombings and the atomic bomb were essential (and therefore justified) in bringing the war to a quick end to avoid even greater allied losses.  I, for one, don't regret it.   Sure.  And it's the people who suffer because of them.  All the more reason to depose these ""entrenched political rulers operating in their own selfish interests""!  Or do you mean that this applies to the allies as well??   I make no claim or effort to justify the misguided foreign policy of the West before the war.  It is evident that the West, especially America, misjudged Hussein drastically.  But once Hussein invaded Kuwait and  threatened to militarily corner a significant portion of the world's oil supply, he had to be stopped.  Sure the war could have been prevented by judicious and concerted effort on the part of the West before Hussein invaded Kuwait, but it is still *Hussein* who is responsible for his decision to invade.  And once he did so, a strong response from the West was required.   Well, it's not very ""loving"" to allow a Hussein or a Hitler to gobble up nearby countries and keep them.  Or to allow them to continue with mass slaughter of certain peoples under their dominion.  So, I'd have to say yes, stopping Hussein was the most ""loving"" thing to do for the most people involved once he set his mind on military conquest.  I mentioned it.  If we hadn't intervened, allowing Hussein to keep Kuwait, then it would have been appeasement.  It is precisely the lessons the world learned in WW2 that motivated the Western alliance to war.  Letting Hitler take Austria and Czechoslavkia did not stop WW2 from happening, and letting Hussein keep Kuwait would not have stopped an eventual Gulf War to protect Saudi Arabia.   Sure.  What was truly unfortunate was that they followed Hitler in his grandiose quest for a ""Thousand Year Reich"".  The consequences stemmed from that.  What should I say about them?  Anything in particular?    So?  It was the *policemen* on trial not Rodney King!!  And under American law they deserved a jury of *their* peers!  If there had been black officers involved, I'm sure their would have been black jurors too. This point (of allegedly racial motivations) is really shallow.   So?  It's ""hard to imagine""?  So when has Argument from Incredulity gained acceptance from the revered author of ""Constructing a Logical Argument""?  Can we expect another revision soon??  :)  (Just kidding.)   I have to admit that I wonder this too.  But *neither* the prosecution nor the defense is talking.  So one cannot conclude either way due to the silence of the principals.     OK.  It certainly seemed to me that there was excessive force involved. And frankly, the original ""not guilty"" verdict baffled me too.  But then I learned that the prosecution in the first case did not try to convict on a charge of excessive force or simple assault which they probably would have won, they tried to get a conviction on a charge of aggravated assault with intent to inflict serious bodily harm.  A charge, which news commentators said, was akin to attempted murder under California law.  Based on what the prosecution was asking for, it's evident that  the first jury decided that the officers were ""not guilty"".  Note,  not ""not guilty"" of doing wrong, but ""not guilty"" of aggravated assault  with the *intent* of inflicting serious bodily harm.  The seeds of the  prosecutions defeat were in their own overconfidence in obtaining a  verdict such that they went for the most extreme charge they could.  If the facts as the news commentators presented them are true, then I feel the ""not guilty"" verdict was a reasonable one.   Thanks mathew, I like the quote.  Pretty funny actually.  (I'm a  Monty Python fan, you know.  Kind of seems in that vein.)  Of course, oversimplifying any moral argument can make it seem contradictory.  But then, you know that already.    Regards,",0
"<stuff deleted>  You mean like: seconds, minutes, hours, days, months, years. . .  :-)  Remember,  the Fahrenheit temperature scale is also a centigrade scale.  Some revisionists tell the history something like this:  The coldest point in a particular Russian winter was marked on the thermometer as was the body temperature of a volunteer (turns out he was sick, but you can't win 'em all). Then the space in between the marks on the thermometer was then divided into hundredths. 								:-)  FWIW,  Doug Page",2
"It wasn't especially prominent, as I recall.  However, quite possibly it's no longer on display; NASM, like most museums, has much more stuff than it can display at once, and does rotate the displays occasionally.",2
"DM> Fact or rumor....?  Madalyn Murray O'Hare an atheist who eliminated the DM> use of the bible reading and prayer in public schools 15 years ago is now DM> going to appear before the FCC with a petition to stop the reading of the DM> Gospel on the airways of America.  And she is also campaigning to remove DM> Christmas programs, songs, etc from the public schools.  If it is true DM> then mail to Federal Communications Commission 1919 H Street Washington DC DM> 20054 expressing your opposition to her request.  Reference Petition number  DM> 2493.  False.  This story has been going around for years.  There's not a drop of truth.  Note that I don't care for O'Hare (O'Hair?) myself, but this is one thing she's not guilty of.",3
"If by that you mean anything on the GD approach, there was an article on it in a recent Avation Week. I don't remember the exact date but it was recent.   Allen",2
"The 68070 is a variation of the 68010 that was done a few years ago by the European partners of Motorola. It has some integrated I/O controllers and half a MMU, but otherwise it's a 68010. Think of it the same as the 8086 and 80186 were.  		Burkhard Neidecker-Lutz",1
PSA 145:9  The LORD is good to all: and his  tender  mercies  are over all his works.,3
"There has been a lot of discussion about Tyre.  In sum, Ezekiel prophesied that the place would be mashed and never rebuilt; as there are a lot of people living there, it would appear that Ezekiel was not literally correct.  This doesn't bother me at all, because I understand the language Ezekiel used differently than do so-called Biblical literalists.  For example, it sometimes happens that someone says ""My grandson is the cutest baby!"" and then turns around and sees the granddaughter and says ""Oh!  Isn't she the cutest thing!?""  This person is not literally claiming to have lined up all the babies in the world according to cuteness and discovered his own grandchildren tied for first.  Rather, he is trying to express his emotions using words that are very object-oriented.  Because this example is one that is common to many people, nobody misunderstands the intent of the statements; the Bible, however, is often at the mercy of people who assume that everything within must be exactly literally true.  For those people, the existence of Tyre is a problem; for me, it is not.   Turning to the latest person trying to defend Ezekiel, we read this from John E King:   No, it implies nothing of the kind.  If you had nothing but the prophecy from Ezekiel, and you were told you interpret it literally, you would never say ""Oh, he means that there will be houses and businesses and plants and stuff like that.""  You would read ""I will make you a bare rock"" and ""You will never be rebuilt"", and you'd conclude that Tyre would be a bare rock.  The only way to get from `fishing nets' to `houses and buildings and a medium-large population' is if you KNOW that all that latter stuff is there.  In other words, your answer means that Ezekiel misled everybody who read the prophecy at the time it was written.  There is no way that, given a literal reading, they could read this passage and conclude ""medium-size city"".  You seem to feel that ""Never be rebuilt"" means ""be rebuilt"" -- maybe so, but it is hardly a `clear implication'.     Well, no.  That's only a bit less than the population of Annapolis, where I'm from.  You know, the Naval Acadamy, the state capital, George Washington resigned his commission in the statehouse?  Annapolis may not be New York, but it's at least a two-horse town.  But supposing 22,000 people is a ""small town"" -- it's still 22,000 people MORE than Ezekiel predicted.   And you've said nothing about the other problem.  In chapter 26, Ezekiel predicts that Nebuchadnezzar will will destroy Tyre and loot all their valuables.  However, Nebuchadnezzar did NOT destroy Tyre, and in chapter 29 Ezekiel even quotes God as saying ""he and his army got no reward from the campaign he led against Tyre.""  Let's ignore Alexander for a moment, and just pay attention to chapter 26. Ezekiel says N. would destroy Tyre, and N. did NOT destroy Tyre.  Ezekiel says that N. would plunder their valuables, but N. did NOT plunder their valuables.  Regardless of what you think about Tyre _now_, the fact is that N. died before the place was destroyed.  Ezekiel said N. was going to do it, and N. did not.   *  This post is, of course, pointless.  Inerrantists have an amazing ability to rewrite the Bible as needed to fit whatever they want it to say.  For example, I expect Mr King to respond to the comments about Ezekiel 26 by pulling some ""clear implications"" out of hat.  When Ezekiel said that N. would ""demolish your towers"", that clearly implied that the walls would still be standing so people would know where the towers used to be.  And when Ezekiel said that N. would ""demolish your fine houses and throw your stones, timber and rubble into the sea"", that clearly implied that N. would never set foot on the island.  And when Ezekiel wrote that N. would ""build a ramp up to your walls"", that clearly implies that N. would spend 13 years stomping around on the mainland and never get close to the walls.  See?  A few ""clear implications"" that are totally contrary to the text, and you can reconcile anything you want.",3
"About a year ago I started work on a problem that appeared to be very simple and turned out to be quite difficult.  I am wondering if anyone on the net has seen this problem and (hopefully) some published  solutions to it.  	The problem is to draw an outline of a surface defined by two roughly parallel cubic splines.  For inputs the problem essentially starts with two sets of points where each set of points is on the  edge of an object which we treat as two dimensional, i.e. only extant between the edges, but which exists in three dimensional space.  To draw  the object we   1) fit a cubic spline through the points.  Each spline is effectively 	computed as a sequence of line segments approximating the         curve.  Each spline has an equal number of segments.  We assume 	that the nth segment along each spline is roughly, but not 	exactly, the same distance along each spline by any reasonable 	measure. 2) Take each segment (n) along each spline and match it to the nth segment 	of the opposing spline.  Use the pair of segments to form two 	triangles which will be filled in to color the surface. 3) Depth sort the triangles 4) Take each triangle in sorted order, project onto a 2D pixmap, draw 	and color the triangle.  Take the edge of the triangle that is 	along the edge of the surface and draw a line along that edge 	colored with a special ""edge color""  	It is the edge coloring in step 4 that is at the heart of the problem.  The idea is to effectively outline the edge of the surface. The net result however generally has lots of breaks and gaps in the edge of the surface.  The reasons for this are fairly complicated. They involve both rasterization problems and problems resulting from the projecting the splines.  If anything about this problem sounds familiar we would appreciate knowing about other work in this area.",1
"I need the file format for cc:Mail file formats - it seems to be PCX-based, but with a twist: only the first page of a multi-page fax will come out readable. The other pages disappear. The format seems to be 'proprietary'.  Anybody got any clues? I have to give my email FAXes to my secretary in order to get 'em unscrambled. I want a filter from cc:Mail to .p[nb]m.  Come to think of it, p[nb]m to cc:Mail would be nice too.",1
"I've got a 386 20Hz computer which is under warranty and my Trident 8900C video card is starting to play-up (surprise, surprise). Therefore I'm going to try to exchange it for a better card.  The BIG Question is:  Which video card is high quality and with an acceptable price tag (on student budget) ???",1
"Please do! And if you don't want to post it here, email to me :-) I don't know how this discussion is appreciated here. I hate 'invading' newsgroups with themes of limited interest :-)",3
"Actually, my atheism is based on ignorance.  Ignorance of the   existence of any god.  Don't fall into the ""atheists don't believe   because of their pride"" mistake.   /\/\/\/\/\/\/\/\/\/\/\/\/\/\/\/\/\/\/\/\/\/\/\/\/\/\/\/\/\/\/\/\/\/\   Bob Beauchaine bobbe@vice.ICO.TEK.COM   They said that Queens could stay, they blew the Bronx away, and sank Manhattan out at sea.",0
"You might be sure, but you would also be wrong.",3
"My package is based on several articles about non-standard radiosity and some unpublished methods.  The main articles are:  -  Cohen, Chen, Wallace, Greenberg :      A Progressive Refinement Approach to fast Radiosity Image Generation      Computer Graphics (SIGGRAPH), V. 22(No. 4), pp 75-84, August 1988  -  Silion, Puech     A General Two-Pass Method Integrating Specular and Diffuse Reflection     Computer Graphics (SIGGRAPH), V23(No. 3), pp335-344, July 1989    I do not use hemi-cubes. I have no special hardware (SUN SPARCstation).   Use anonymous as username and your e-mail address as password.    Stephan.   ----------------------------------------------------------------------------   Stephan Amann     SIG Computer Graphics, University of Berne, Switzerland            amann@iam.unibe.ch 	   Tel +41 31 65 46 79	   Fax +41 31 65 39 65   Projects: Radiosity, Raytracing, Computer Graphics",1
